<?xml version="1.0" encoding="UTF-8"?>
<zalba_na_cutanje broj_zahteva="123" broj_zalbe="321" xmlns="http://www.projekat.org/zalba_cutanja"
    xmlns:xsi="http://www.w3.org/2001/XMLSchema-instance"
    xsi:schemaLocation="http://www.projekat.org/zalba_cutanja file:/C:/Users/Aleksa/Desktop/7.%20semestar/XML%20i%20veb%20servisi/%D0%9F%D1%80%D0%BE%D1%98%D0%B5%D0%BA%D0%B0%D1%82/dokumenti_xml/konacno/zalba_cutanja.xsd">
    <adresa_poverenika>
        <mesto>Beograd</mesto>
        <ulica>Bulevar kralja Aleksandra</ulica>
        <broj>15</broj>
    </adresa_poverenika>
    <organ_protiv_kojeg_je_zalba>
        <adresa>
            <mesto>Novi Sad</mesto>
            <ulica>Futoska ulica</ulica>
            <broj>1</broj>
        </adresa>
        <naziv>RNG</naziv>
    </organ_protiv_kojeg_je_zalba>
    <podaci_o_zahtevu>
        <informacije>info</informacije>
        <datum>2020-10-10</datum>
        <zahtevi>
            <uvid/>
            <kopija/>
        </zahtevi>
    </podaci_o_zahtevu>
    <podaci_o_zalbi>
        <podnosilac_zalbe>
            <lice xmlns:xsi="http://www.w3.org/2001/XMLSchema-instance" xsi:type="TFizicko_lice">
                <adresa>
                    <mesto>Novi Sad</mesto>
                    <ulica>Narodnog fronta</ulica>
                    <broj>23d</broj>
                </adresa>
                <ime>Jelena</ime>
                <prezime>Jelenovic</prezime>
            </lice>
            <drugi_podaci_za_kontakt>0612971992</drugi_podaci_za_kontakt>
        </podnosilac_zalbe>
        <datum_podnosenja>2020-10-10</datum_podnosenja>
        <mesto>Novi Sad</mesto>
        <razlog_zalbe>nije postupio</razlog_zalbe>
    </podaci_o_zalbi>
</zalba_na_cutanje>